Keys,"English [en-GB]"
Scenario_Campaign_054_Success_2,"Suddenly a voice echoes through the palace: “You have returned my power, but that is not enough. I will take this body as my vessel!” "
Scenario_Campaign_054_Success_3,"The vortex condenses into a sphere that hits the Seeker in the chest faster than you can react. The Seeker falls to the ground dead."
Scenario_Campaign_054_Success_4,"You rush to the corpse, only to find horrendous insects bursting out of its skin. You step back in horror as the grotesque insect horde arises and speaks. "
Scenario_Campaign_054_Success_5,"“I am reborn! The plague walks the earth once more!”"
Scenario_Campaign_055_Objective_1,"Loot the treasure chest in the third room "
Scenario_Campaign_055_Start_1,"You collect yourself and step into the unknown."
Scenario_Campaign_055_Success_1,"The fog seems to be sapping your strength as you stumble through it, one painful step at a time. "
Scenario_Campaign_055_Success_2,"Just when you think you can’t make it any farther, however, you find a hidden cache of supplies marked with the purple emblem of your quarry."
Scenario_Campaign_055_Success_3,"You quickly open the cache and find a detailed map of the area with precise instructions on navigating your way to the camp. You snatch it up and flee off into the trees, away from the fog."
Scenario_Campaign_055_Success_4,"With this map, you feel your quest is finally nearing its end."
Scenario_Campaign_056_Objective_1,"Kill all enemies "
Scenario_Campaign_056_Objective_2,"Protect at least one captive Orchid"
Scenario_Campaign_056_Room_4_1,"You reach the main bandit encampment in a large, open clearing. Looking beyond the formidable force of enemies before you, you see a group of ragged Orchids off to one side—more victims of these monsters.
"
Scenario_Campaign_056_Room_4_2,"The captive Orchids notice your arrival and use the opportunity to slip out of their bonds and overwhelm one of their distracted captors. You smile, knowing your family will be avenged this day."
Scenario_Campaign_056_Room_4_3,"The bandits look back and forth between you and the escaping captives in a panic. One of the guards hefts his sword and charges. “Kill them all! No one shall escape!”"
Scenario_Campaign_056_Success_1,"With the last of the bandits dead, one of the surviving captives approaches your group and falls to his knees."
Scenario_Campaign_056_Success_2,"“I thank you for rescuing us,” he says quietly. “Know that my tribe will forever be your ally.”"
Scenario_Campaign_056_Success_3,"As he gathers his companions and heads off into the forest back home, you survey the carnage around you. "
Scenario_Campaign_056_Success_4,"The group of bandits has indeed been eradicated and you feel relief finally knowing revenge was delivered for your village. "
Scenario_Campaign_056_Success_5,"There are plenty of spoils here to help you start a new life as well—a first step towards a more secure future."
Scenario_Campaign_057_Objective_1,"Kill the Infiltrator "
Scenario_Campaign_057_Room_2_1,"It seems you’ve interrupted the houndmaster feeding his dogs. He doesn’t look very pleased by your intrusion."
Scenario_Campaign_057_Room_2_2,"“I guess my pets could use some fresh meat,” he grumbles, letting loose the chains."
Scenario_Campaign_057_Room_3_1,"You have found the main barracks, and as the door opens, a foreboding feeling comes over you. You recognize the lieutenant in the corner bellowing out orders. "
Scenario_Campaign_057_Room_3_2,"“Alarm! Intruders! Don’t let them get away! Slay them!” You are on the right track. Bring him to justice, then search his remains for clues."
Scenario_Campaign_057_Room_4_1,"“Halt! Trespassers! What are you doing in the provision storage of the city watch?” You turn to see two guards emerge from a door behind you. "
Scenario_Campaign_057_Room_4_2,"This wasn’t what you were after, but you don’t have any time to explain. Hopefully you can dispatch the guards quickly."
Scenario_Campaign_057_Room_5_1,"You interrupt a training exercise for several new recruits. The master isn’t pleased with the disruption and calls upon his trainees to practice their skills on his unwelcome guests."
Scenario_Campaign_057_Success_1,"Combing through the remains of the Infiltrator, you find a schedule to a meeting outside the city in a remote shack. There are notes about harvesting corpses. "
Scenario_Campaign_057_Success_2,"You look forward to crashing this meeting and exacting your revenge. With the spy revealed, the remaining city watch thanks you for exposing him."
Scenario_Campaign_058_BonePile,"Bone Pile"
Scenario_Campaign_058_Objective_1,"Kill the Harvester "
Scenario_Campaign_058_Room_3_1,"As you burst through the door, you notice a strange-looking box spattered with blood. You see it holds a curved, serrated dagger that glows red."
Scenario_Campaign_058_Room_3_2,"Recalling your dead friend’s wounds, you have a strong suspicion this was the weapon that murdered him. It’s time to return the favor to its owner."
Scenario_Campaign_058_Room_4_1,"Piles of rotting bones adorned with occult glyphs greet you as you enter the back room. At the center, a malicious human figure sits on a throne of skulls. "
Scenario_Campaign_058_Room_4_2,"He stands, gathering necromantic energies from the surrounding bone piles. “I feel the desire for vengeance burning bright within your heart. I will feast well upon it!”"
Scenario_Campaign_058_Success_1,"Bloodlust is a strange thing. Once it is sated, it leaves a hollow shell of a person behind. The dagger clatters to the floor as a cold, numb feeling spreads through you. "
Scenario_Campaign_058_Success_2,"The job is done, and it is time to move on, however hard that may be."
Scenario_Campaign_059_Objective_1,"Kill all enemies "
Scenario_Campaign_059_Objective_2,"Loot the Ornate Chest with a Loot action (not end-of-turn looting)"
Scenario_Campaign_059_Success_1,"With steely determination, you fight your way through the wild animals and reach the plant you seek at the back of the grove. "
Scenario_Campaign_059_Success_2,"When you lean down to inspect it, however, you see that the plant bears no fruit. It has been harvested very recently."
Scenario_Campaign_059_Success_3,"With confusion you glance around the grove, looking for clues to where the fruit could have gone. "
Scenario_Campaign_059_Success_4,"That’s when you see the deep axe marks in all of the trees around you. Someone chopped at the bark, not intending to cut the trees down, but only to wound them."
Scenario_Campaign_059_Success_5,"Whoever it was wanted to anger the wildlife and have them viciously attack whomever came to this grove. And then you notice the faint tracks of a Quatryl in the dirt. "
Scenario_Campaign_059_Success_6,"That conniving little... "
Scenario_Campaign_060_Objective_1,"Loot all Ornate Chests and then all mercenaries must escape through the entrance "
Scenario_Campaign_060_Objective_2,"All mercenaries must escape through the entrance "
Scenario_Campaign_060_Success_1,"You race out of the building, dodging a rain of burning debris. You barely make it through the door and clear of the structure before the whole thing collapses into a flaming mountain of rubble."
Scenario_Campaign_060_Success_2,"You cough violently, and scan the crowd once more. The Quatryl is nowhere to be found. You had no time to restrain her and now she is no doubt long gone, most likely fleeing the city."
Scenario_Campaign_060_Success_3,"It matters not. However arduous and harried the journey was, the end result is that you now have the cure necessary to save your village. It is time to leave Gloomhaven and return home."
Scenario_Campaign_060_Success_4,"Before leaving, though, you give some of the cure to the alchemists of the University. You hope that it can do some good in Gloomhaven as well."
Scenario_Campaign_061_Objective_1,"Loot all Ornate Chests with a Loot action (not end-of-turn looting)"
Scenario_Campaign_061_Room_5_1,"You reach the fort’s center with a stack of old journals under your arm. "
Scenario_Campaign_061_Room_5_2,"Scanning the floor, you see one more book lying precariously close to a Flame Demon. You also notice, however, an altar in the middle of the room, slowly pulsing with an odd energy."
Scenario_Campaign_061_Room_5_3,"You study it for a second, realizing that it seems to be pulsing at the same frequency that the building is oscillating between planes."
Scenario_Campaign_061_Room_5_4,"Perhaps if you could destroy it, you could ground the fort in your own plane."
Scenario_Campaign_061_Success_1,"You grab the last book and then smash the altar. In a bright flash, all the monsters are sucked into another plane and the fort falls silent, no longer fading in and out."
Scenario_Campaign_061_Success_2,"You gather all the books and head back down to the ground floor to study them."
Scenario_Campaign_061_Success_3,"They are mostly useless, but one of the books is exactly what you are looking for: a journal of a young girl who was in the fort when it was changed."
Scenario_Campaign_061_Success_4,"The text is old and the pages crumble, but you are able to make out some of the details. The girl, Eva, and many others fled from their city of Eastport when a horde of demons invaded."
Scenario_Campaign_061_Success_5,"She expresses some confusion over exactly where the demons came from, but the details of the many horrors she witnessed are very clear. Many of her friends were torn apart or eaten alive."
Scenario_Campaign_061_Success_6,"One of the head researchers of Eastport’s academy gathered all the survivors he could find and fled the city, hoping to hide out in this fort."
Scenario_Campaign_061_Success_7,"When it was clear that the demons had followed them and they had nowhere else to run, the researcher sent them all down to the hidden basement and attempted to perform an inter-planar ritual to save them."
Scenario_Campaign_061_Success_8,"You close the journal. He wanted to escape the demons by transporting the entire fort to another plane, but it is evident that, one way or another, the ritual went horribly wrong."
Scenario_Campaign_061_Success_9,"The only thing left to do is investigate this hidden basement."
Scenario_Campaign_062_Misc_1,"As you destroy more and more of the shambling skeletons, you begin to see the faint shimmer of their souls drift toward the back of the room, where they coalesce and infuse a large pile of bones. "
Scenario_Campaign_062_Misc_2,"With enough skeletons broken and crushed, the glowing bone pile begins to vibrate and move."
Scenario_Campaign_062_Misc_3,"“You should not have come here! I continue to feast on my victims even in death, but their spirits have grown stale."" "
Scenario_Campaign_062_Misc_4,"""You wish to disturb us here? Free my prisoners from their phantasmal chains? Now those chains will bind you instead!”"
Scenario_Campaign_062_Misc_5,"Out of the pile of bones, a form begins to take shape. It is a massive collection of skulls, ribs, femurs, and others bones, which create a fearsome beast of malice."
Scenario_Campaign_062_Objective_1,"Kill the Hungry Soul"
Scenario_Campaign_062_Objective_2,"Kill 10 Living Bones"
Scenario_Campaign_062_Success_1,"With one final blow, the mass of remains blasts apart and a great burst of light shoots through the room, returning the remaining enemies to inanimate bone.
"
Scenario_Campaign_062_Success_2,"“Thank you travelers.” A disembodied voice echoes through your head. "
Scenario_Campaign_062_Success_3,"“I tried to save these people, but instead damned them to eternal torment. You have now freed us, and we are forever grateful.”"
Scenario_Campaign_062_Success_4,"You call out to the voice, desperate to know what happened in Eastport, why the demons attacked, and where they came from."
Scenario_Campaign_062_Success_5,"“We brought this upon ourselves. In our studies, we tried to travel beyond this world, but in the end, we only managed to open a rift to a hellish nightmare. The demons came through and overwhelmed us like a rising tide."""
Scenario_Campaign_062_Success_6,"“And even in that folly, I learned nothing. I brought these people here and again unleashed powers I did not fully understand. I am so ashamed.”"
Scenario_Campaign_062_Success_7,"The voice fades from your mind. You call out to it, but there is no response. At least you have found the answers you sought, though your heart is no lighter for it."
Scenario_Campaign_063_Success_1,"The last of the Inox shrieks and collapses at your feet. Though less armoured than most Inox, this particular group made up for it with an almost otherworldly ferocity. "
Scenario_Campaign_063_Success_2,"And fighting alongside demons? The thought is truly troubling. It seems the influence of these demons is growing, and you are grateful that you have at least managed to push them back in some small way. "
Scenario_Campaign_063_Success_3,"And the treasure is nice as well, of course. You stow it in your packs and begin to make the long journey back home.  "
Scenario_Campaign_064_Success_1,"Finally, a peace falls over the cavern and you take a moment to savor the calm. You'd love to spend hours here, so far removed from the rigors and annoyances of everyday life. "
Scenario_Campaign_064_Success_2,"But the captain said he wouldn't wait long, and getting stranded here would certainly not be ideal. "
Scenario_Campaign_064_Success_3,"You take one last moment to breathe it all in, then head back through the cave and jump into the underwater tunnel. Luckily the merchant ship is still right where you left it, so you row over to its side and get hoisted back on board.  "
Scenario_Campaign_065_Objective_1,"Kill all enemies "
Scenario_Campaign_065_Objective_2,"Loot all Ornate Chests "
Scenario_Campaign_065_Success_1,"You don't even bother reading all of the scraps of paper you find lying around the mine. You simply stuff them into your pack as you kill all the creatures that stand in your way. "
Scenario_Campaign_066_Objective_1,"Occupy the pressure plate in the final room "
Scenario_Campaign_066_Room_2_1,"After traversing the entryway, you open a heavy metal door, unleashing a cacophony of whirling gears and moving machinery."
Scenario_Campaign_066_Room_2_2,"The entirety of the ancient cavern is part of some huge, intricate mechanical system that is still alive and operating deep beneath the earth."
Scenario_Campaign_066_Room_2_3,"Unfortunately, its guardians are still alive as well, and it will take more than brute force to navigate through all this chaos."
Scenario_Campaign_066_SCENARIO_MODIFIER_1,"Pressure-plate-locked doors will only stay open as long as any mercenary occupies the pressure plate in the previous room. The penultimate pressure plate will also open the two auxiliary rooms. If any mercenary moves off a pressure plate, the corresponding door will close at the end of that turn unless another corresponding plate is currently activated. Anything occupying a door when it closes suffer trap damage and are moved to the nearest unoccupied hex."
Scenario_Campaign_066_Success_1,"With the last plate activated, a massive boom echoes throughout the chamber and the gears slowly grind to a halt. "
Scenario_Campaign_066_Success_2,"Luckily, this seems to sap the power of the guardians, as well, and what was once a raucous turmoil is now eerily quiet. The gears lay dormant and the machinery no longer whirs."
Scenario_Campaign_067_Objective_1,"Kill the Arcane Golem"
Scenario_Campaign_067_Room_2_1,"The door nearly falls off its rusted hinges as you push against it, allowing you to make your way into a water-logged tunnel beneath the tower. "
Scenario_Campaign_067_Room_2_2,"Scanning the room, you immediately see words scratched deeply into the stone wall: “I am a monster. I am evil. I am soulless.”"
Scenario_Campaign_067_Room_3_1,"The door swings open to reveal a pristine library with a massive stone golem at its center. Surprisingly, the golem speaks in a gravelly, hard voice. "
Scenario_Campaign_067_Room_3_2,"“No! Why have you come here? I have destroyed all there was to take. Why do you force me to kill?”"
Scenario_Campaign_067_SCENARIO_MODIFIER_1,"The door to the third room will only remain open if the pressure plate in the second, the third room, or both are occupied by a mercenary. Anything occupying a door when it closes suffer trap damage and are moved to the nearest unoccupied hex."
Scenario_Campaign_067_SCENARIO_MODIFIER_2,"The Arcane Golem cannot leave the room it is in."
Scenario_Campaign_067_Success_1,"The glyphs on the golem’s limbs begin to fade and chunks of stone fall from its frame as it utters two more words: “Thank you.” "
Scenario_Campaign_067_Success_2,"Rummaging through the library, you find a journal detailing how the golem was given intelligence and the capacity to learn. "
Scenario_Campaign_067_Success_3,"What it learned, however, was that it was a soulless monster, and that it could not connect with anything else since it was commanded to never leave and to kill all intruders. "
Scenario_Campaign_067_Success_4,"You also find a glowing power core inside the golem’s body."
Scenario_Campaign_068_Objective_1,"Kill all enemies "
Scenario_Campaign_068_Objective_2,"Protect the tree "
Scenario_Campaign_068_Success_1,"With the final creature destroyed, you are finally able to turn your attention to the tree and put out the blaze. It is heavily charred, but it should survive.
"
Scenario_Campaign_068_Success_2,"“I cannot thank you enough for what you have done, strangers,” the old Inox says. "
Scenario_Campaign_068_Success_3,"“I don’t know why you showed up when you did, but I believe it was the work of the spirits. You are a miracle!”"
Scenario_Campaign_068_Success_4,"The woman scratches her head. “I cannot fathom what would cause drakes to travel so far south, though. Perhaps there is something working against the spirits as well.”"
Scenario_Campaign_068_Success_5,"She hands you a couple of potions. “In any case, please take these as a token of my thanks. My tribe extracts the healing powers of the tree to make them. I hope they are of some use to you.”"
Scenario_Campaign_068_Tree,"Sacred Tree"
Scenario_Campaign_069_Objective_1,"Pick up the Doll"
Scenario_Campaign_069_Objective_2,"Bring the Doll to the Well "
Scenario_Campaign_069_Success_1,"You cast the doll into the well and return to the man, who thanks you with coin."
Scenario_Campaign_070_Objective_1,"Kill all demons "
Scenario_Campaign_070_Room_5_1,"You reach the back of the cave, desperately trying to stay ahead of the converging swarm of spirits behind you. Ahead of you, more powerful demons await your approach."
Scenario_Campaign_070_Room_5_2,"“There is no hope for you, fools!” The monstrous demon of violent currents speak through a howling wind. “Our army of slaves is innumerable. They will consume your flesh and add you to their ranks.”"
Scenario_Campaign_070_Success_1,"The last of the demons is destroyed, and an unearthly howling echoes throughout the room as the spirits around you slowly fade from view. "
Scenario_Campaign_070_Success_2,"You stay on guard, but the wind and anger subsides, and the cave grows peaceful. "
Scenario_Campaign_070_Success_3,"You can no longer feel the overwhelming sense of dread that hung over you since you first stepped foot on the island."
Scenario_Campaign_071_Objective_1,"Loot all Ornate Chests"
Scenario_Campaign_071_Objective_2,"All mercenaries must escape through the exit "
Scenario_Campaign_071_Success_1,"You grab what jerry root you can, and then carefully climb back down the mountain before the rest of those drakes wake up. "
Scenario_Campaign_071_Success_2,"You just hope all the pain and trouble was worth it."
Scenario_Campaign_072_Objective_1,"Destroy the Left Tree"
Scenario_Campaign_072_Objective_2,"Kill all Oozes"
Scenario_Campaign_072_Objective_3,"Destroy the Middle Tree"
Scenario_Campaign_072_Objective_4,"Destroy the Right Tree"
Scenario_Campaign_072_Success_1,"The green mold covering the ground ripples and convulses as the final tree crashes to the earth. Maybe it’s your imagination, but you can almost hear it screaming.
"
Scenario_Campaign_072_Success_2,"Then all the slime turns brown and becomes still. You are not sure this land will ever grow crops again, but you neutralized the threat. "
Scenario_Campaign_072_Success_3,"Hopefully that is enough for Greymare to hold up his end of the bargain."
Scenario_Campaign_072_Tree,"Tree"
Scenario_Campaign_073_Objective_1,"Kill all enemies "
Scenario_Campaign_073_Objective_2,"Loot all Ornate Chests "
Scenario_Campaign_073_Room_3_1,"You enter the mouth of the cave and come face-to-face with an angry Inox shaman. Rocks fall from the cave's ceiling all around him. "
Scenario_Campaign_073_Room_3_2,"“Get back, city rats! This land is ours and will not be defiled! Run back down the mountain or feel our wrath!”"
Scenario_Campaign_073_Room_3_3,"You smile wryly at the Inox. You didn’t climb all the way up here just to go home empty-handed."
Scenario_Campaign_073_Success_1,"With the Inox dead, you take stock of what you found in the cave's final section. "
Scenario_Campaign_073_Success_2,"It is mostly earthen pots full of ash and bits of bone, but among their belongings, you do find a large tome. "
Scenario_Campaign_073_Success_3,"It is hacked up and falling apart, but most of the pages are still readable. You carefully stow it in your pack and head back to Gloomhaven."
Scenario_Campaign_074_Objective_1,"Each mercenary must loot one Ornate Chest"
Scenario_Campaign_074_Objective_2,"No mercenary may exhaust before looting an Ornate Chest"
Scenario_Campaign_074_Room_6_1,"As you continue to plunder what you can during the fight, it becomes apparent that these aren’t just any bandits. They wear the same insignia of the bandit clan that boarded your ship. "
Scenario_Campaign_074_Room_6_2,"Unfortunately, it also becomes apparent that there are far more of them than there are of you–you won’t survive here much longer. "
Scenario_Campaign_074_Success_1,"Confident you’ve gathered as many of Gavin’s goods as you can, you decide it would be best to run for your lives. "
Scenario_Campaign_075_Objective_1,"Dig up all the graves"
Scenario_Campaign_075_Objective_2,"Kill the Bloated Regent"
Scenario_Campaign_075_Room_3_1,"You find a large, ornate sarcophagus at the back of the graveyard, and the screeching of spirits assaults your ears. "
Scenario_Campaign_075_Room_3_2,"“Do not disturb the treasures of the regent! They are not for peasant hands!”"
Scenario_Campaign_075_Success_1,"“Well done, indeed,” Nick marvels when you emerge from the graveyard with the stolen valuables. "
Scenario_Campaign_075_Success_2,"“It’ll take me ages to find buyers for all this old crap, but, trust me, there are plenty of people who just go crazy for this kind of stuff.”"
Scenario_Campaign_075_Success_3,"He methodically goes through everything you have and then counts out a large sum of money into a hefty coin purse."
Scenario_Campaign_075_Success_4,"“Given what I expect to unload all this for, here’s your agreed upon cut. Pleasure doing business with you!”"
Scenario_Campaign_076_Objective_1,"Reveal all rooms"
Scenario_Campaign_076_Objective_2,"Kill all enemies "
Scenario_Campaign_076_Success_1,"Night Demons and animated dead—this was certainly a foul congregation of Harrowers up to no good. "
Scenario_Campaign_076_Wall,"Wall"
Scenario_Campaign_077_Objective_1,"Loot all Ornate Chests"
Scenario_Campaign_077_Objective_2,"Stop all City Guards before the alarm is raised "
Scenario_Campaign_077_Room_2_1,"“What in the—?” A guard moving barrels jumps up in surprise. “Intruders! Sound the alarm! Release the hounds! Power the golems! The Vigil will stand tall!”"
Scenario_Campaign_077_Success_1,"Searching through the vault libraries, you find both the Codex and Dominic’s book without too much trouble. "
Scenario_Campaign_077_Success_2,"You find many other strange texts among the shelves: “Golems and Constructs,” “The Algox of the North.” "
Scenario_Campaign_077_Success_3,"There is a lot of hidden knowledge here, but there is no time to sort through it all. More of the Vigil could come down the stairs at any moment and alert the entire estate to your presence."
Scenario_Campaign_077_Success_4,"You grab what you came for and run for the exit, stepping over the corpses of the guards who stood in your way. "
Scenario_Campaign_078_Objective_1,"Kill all enemies"
Scenario_Campaign_078_Objective_2,"Stop the sacrifice"
Scenario_Campaign_078_Room_2_1,"You burst through the door at the end of the hallway and see a naked man in chains kneeling in the center of the room. Around him are many figures in dark robes."
Scenario_Campaign_078_Room_2_2,"“Get him up! Get him to the altar!” one of the figures yells as he moves towards the prisoner."
Scenario_Campaign_078_Room_2_3,"“The rest of you deal with these intruders. Once our dark master feeds on the innocent blood, our unwelcome guests will be destroyed by his power!”"
Scenario_Campaign_078_Success_1,"Once all the Ravens are dead, you smash the altar to pieces and free the man."
Scenario_Campaign_078_Success_2,"“Th-thank you so much,” he sobs. “I was sure I was dead. They said I was lucky, that my blood was going to be what brought their Raven god back to life."" "
Scenario_Campaign_078_Success_3,"""I thought they were referring to some kind of bird, but they kept chanting about mandibles and a carapace.”"
Scenario_Campaign_078_Success_4,"Luckily, you won’t have to find out exactly what the Ravens were trying to set free. Their corpses can join their god in permanent death."
Scenario_Campaign_079_Objective_1,"Kill the Betrayer"
Scenario_Campaign_079_Objective_2,"Keep Fish Alive"
