Keys,"English [en-GB]"
Scenario_Campaign_030_Objective_1,"Loot the Ornate Chest with a Loot action (not end-of-turn looting)"
Scenario_Campaign_030_Success_1,"You grab hold of the scepter and the entire building shudders violently. A dark energy bursts forth, piercing through the chests of the monsters still attacking you. They all fall over dead and the shuddering stops."
Scenario_Campaign_030_Success_2,"As you get back to your feet, however, a sharp pain suddenly pierces your skull. "
Scenario_Campaign_030_Success_3,"“You have been misled,” the Voice speaks into your mind. “Do not bring that scepter to me! If you free me, I guarantee no harm will come to you."" "
Scenario_Campaign_030_Success_4,"""But I cannot say the same if you approach with the scepter. Whatever you think you are doing, you are wrong.”"
Scenario_Campaign_030_Success_5,"As quickly as it came, the pain stops. You tighten your grip on the scepter and race out of the shrine, eager to bring it to the Echo Chamber and silence the Voice."
Scenario_Campaign_031_Objective_1,"Destroy the rock column"
Scenario_Campaign_031_RockColumn,"Rock Column"
Scenario_Campaign_031_Room_3_1,"Just as you are beginning to think that Hail sent you to the wrong place, you gratefully see the outline of a tower in the distance. "
Scenario_Campaign_031_Room_3_2,"The thing is massive, with twisting ropes of darkness weaving in and out of one another, reaching up through an opening in the cavern ceiling above you."
Scenario_Campaign_031_Success_1,"With one last swing, the tower of black rope severs. The strands writhe and whip around, quickly ascending out of the cave, as if falling away up into the sky. "
Scenario_Campaign_031_Success_2,"The ground shudders. Cracks form beneath your feet, and there is a loud grating noise as the whole chamber shifts and begins to crash downward."
Scenario_Campaign_032_Objective_1,"Reach the back of the Harrowers' shack"
Scenario_Campaign_032_Objective_2,"Kill all revealed enemies "
Scenario_Campaign_032_Objective_3,"Loot the vessel from the Harrowers' coffers"
Scenario_Campaign_032_Success_1,"The Harrowers proved quite difficult to take down, but in the end they fell just like any other foe. "
Scenario_Campaign_032_Success_2,"Feeling the rot of the place seeping into your bones, you hurriedly ransack the dwelling and locate the small earthen pot shown to you by the Voice."
Scenario_Campaign_032_Success_3,"When you pick it up, the Voice fills your head. “Good! Yes, excellent! The infesters were but one guardian employed to block my passage. I give you now the second location. Please bring the vessels back to me. I will reward you greatly.”"
Scenario_Campaign_033_Objective_1,"Loot all Ornate Chests"
Scenario_Campaign_033_Objective_2,"All mercenaries must escape through the exit"
Scenario_Campaign_033_Room_4_1,"You hear the alarm ringing clearly in the distance. You’ve kicked over a hornets’ nest and it’s just a matter of time before you are swarmed."
Scenario_Campaign_033_Room_4_2,"You enter the inner chamber and scan the room. There’s a lot of treasure here. Best just to grab it all."
Scenario_Campaign_033_SCENARIO_MODIFIER_1,"The door to the final room will open once all pressure plates have been activated simultaneously. "
Scenario_Campaign_033_Success_1,"You round the corner just as a ball of fire flies in your direction. It explodes on the far wall and collapses the tunnel behind you. "
Scenario_Campaign_033_Success_2,"You break into a full sprint and, within minutes, emerge from the mountain and continue speeding into the surrounding foothills. "
Scenario_Campaign_034_Objective_1,"Kill the Elder Drake"
Scenario_Campaign_034_Success_1,"With one final blood-curdling screech, the giant drake falls off its perch and crashes to the snowy ground. It appears to still be alive, but its breaths are weak and shallow.
"
Scenario_Campaign_034_Success_2,"“Bloodthirsty and obtuse. I don’t know why I should have expected more,” the drake whispers. “Congratulations on your stunning success."""
Scenario_Campaign_034_Success_3,"""I’m sure you will be heralded as heroes upon your triumphant return. Adorned in crowns of gold and cloaks of silk. Riches will be laden upon you and five thousand...”"
Scenario_Campaign_034_Success_4,"The drake’s whispers trail off and the breathing stops. "
Scenario_Campaign_035_Objective_1,"Destroy the door"
Scenario_Campaign_035_Objective_2,"Kill the Captain of the Guard"
Scenario_Campaign_035_Room_2_1,"As you hack away at the wooden door, an explosion erupts from it, sending gouts of flame dancing among splinters of wood and shards of rock."
Scenario_Campaign_035_Room_2_2,"A shock wave blows you from your feet and you recover to see nothing but billowing smoke where the door once was. The way is clear. Now it’s time to bring down the Captain."
Scenario_Campaign_035_Start_1,"“Take my place at the head of my army. Crush this wall and bring me that human’s head!”"
Scenario_Campaign_035_Success_1,"“Traitorous idiots!” The Captain spits blood in your face. “You’ve doomed everyone in this town! Why would you do this?”"
Scenario_Campaign_035_Success_2,"A shadow is cast over his fallen body. You look to see the tall, bleeding figure of the Prime Demon standing over him. "
Scenario_Campaign_035_Success_3,"“Wealth, power, all the things you humans scrabble after every day of your miserable lives."" "
Scenario_Campaign_035_Success_4,"""These mercenaries, however, were fortunate enough to find someone who would actually give it to them instead of making empty promises."""
Scenario_Campaign_035_Success_5,"“I will stay true to my word. Only those who opposed me will die. The rest are free to continue to live and toil in this place under my rule. I will return to my realm and plan my next move.”"
Scenario_Campaign_036_Misc_1,"With a terrifying roar, the great demon commander leaps forward from the back ranks and lands the final blow against the old gate. It buckles and gives way under his force. "
Scenario_Campaign_036_Misc_2,"He seems winded, though, and is clearly very injured. If you can take him down, the whole attack force should be dispersed."
Scenario_Campaign_036_Objective_1,"Kill the Prime Demon"
Scenario_Campaign_036_Objective_2,"Protect the door for 8 rounds"
Scenario_Campaign_036_Start_1,"“That’ll teach him!” the Captain shouts at you. “Keep them at bay! I must head to the other gates and prepare for assaults there as well.” "
Scenario_Campaign_036_Start_2,"He grabs you with a firm hand. “Don’t let them through!”"
Scenario_Campaign_036_Success_1,"The demon bellows and falls, shaking the earth as it crashes down. Its clawed hand opens to reveal the artifact. "
Scenario_Campaign_036_Success_2,"“I thought it would give me enough power. I thought it could sustain me on this plane. I was foolish, and now look at me. Broken and destroyed at the feet of mortals. Humiliating.” The demon gurgles and goes still."
Scenario_Campaign_036_Success_3,"The Captain steps up beside you. “The rest of the force is dispersing,” he says. “It was unpleasant, but we prevailed, thanks to you.”"
Scenario_Campaign_037_Objective_1,"All mercenaries must escape through the exit"
Scenario_Campaign_037_Success_1,"You press ever forward, leaving the wretched trench. Looking behind you, you see the figures of more Lurkers waiting in the shadows, but they do not pursue. Perhaps they are afraid of whatever lies ahead. "
Scenario_Campaign_037_Success_2,"You go deeper through a crack in the earth until your path shifts suddenly upwards. You emerge from the cold, unforgiving water into an air pocket deep beneath the waves. "
Scenario_Campaign_037_Success_3,"You spit out your water-breathing orb, grateful to finally breathe normally and take a short rest. Through the darkness ahead of you, you see an expansive cavern, which houses a massive stone structure. "
Scenario_Campaign_037_Success_4,"This unnatural sight, so far removed from anything you are familiar with, fills you with irrational, foreboding dread. "
Scenario_Campaign_038_Objective_1,"Kill all enemies"
Scenario_Campaign_038_Objective_2,"Protect the Orchid "
Scenario_Campaign_038_Start_1,"“Yes, I can guide you through the deeper forest,” the Orchid says. “But I cannot abandon my brethren or let what these Inox are doing go unanswered.” He moves over to a guard’s corpse and picks up a blade."
Scenario_Campaign_038_Start_2,"""You can help me if you want, but either way, blood must be spilled in this place."" The Orchid rushes forward at a group of Inox, yelling wildly. "
Scenario_Campaign_038_Start_3,"Soon the whole camp is bustling with hostile activity. 

If you want a guide, it looks as though you'll need to keep him alive. "
Scenario_Campaign_038_Success_1,"With the last of the Inox and their golems dead, the Orchid drops his sword and falls to his knees."
Scenario_Campaign_038_Success_2,"“Thank you,” he says. “They killed my family when they came. They said my children were not strong enough workers.”
"
Scenario_Campaign_038_Success_3,"The Orchid dips his fingers in a pool of blood and begins to paint his face with it. “I thought killing them all would help, but I still feel hollow."""
Scenario_Campaign_038_Success_4,"“I owe you a debt for what you have done. I will gladly lead you into the western forest. On the way, however, I would like to check on a neighboring Orchid village. I fear that this may not be the last of the slaving Inox tribe.”"
Scenario_Campaign_038_Success_5,"The Orchid stands and turns to you, his face now a red mask of ferocity and hatred. “I am called Redthorn. Follow me.”"
Scenario_Campaign_039_Altar,"Orb Altar"
Scenario_Campaign_039_Objective_1,"Destroy the altar"
Scenario_Campaign_039_Room_2_1,"Hoping to get the drop on anything else that may be waiting in the cave’s next chamber to attack you, you bust down the door and storm in."
Scenario_Campaign_039_Room_2_2,"There are more enemies in this cave, of course, but you are more concerned about the glowing white orb behind the crystalline demons. "
Scenario_Campaign_039_Room_2_3,"The pieces all start to fall into place. They are controlling the weather here, blocking your passage to the peak. If you can destroy the orb, you hope the punishing weather will subside."
Scenario_Campaign_039_Success_1,"Pieces of the shattered orb fall to the snowy floor along with the corpses of the enemies who stood in your way. "
Scenario_Campaign_039_Success_2,"The screeching of the wind outside the cave lessens to a faint murmur. You exit to see clear skies above you and a path to the peak."
Scenario_Campaign_039_Success_3,"At this altitude, without a cloud in sight, you find yourself looking out over the horizon, marveling at the wondrous expanse of mountains and the forests and plains beyond them. "
Scenario_Campaign_039_Success_4,"You can even see the faint outline of Gloomhaven in the distance."
Scenario_Campaign_039_Success_5,"Looking to the west, your curiosity is piqued by a lake high in the mountains and a small stone structure resting at its edge. "
Scenario_Campaign_039_Success_6,"You make a note of the building—it might be worth investigating in the future."
Scenario_Campaign_040_Objective_1,"Occupy both pressure plates simultaneously"
Scenario_Campaign_040_Success_1,"From opposite ends of the network, you activate the switches in the order shown to you by the Voice. As quickly as it came, the alarm subsides and the walls of the rooms open, leading you back to the entrance. "
Scenario_Campaign_040_Success_2,"There, the center of the floor slides away, revealing a narrow ladder descending down into the dark."
Scenario_Campaign_040_Success_3,"“The way to the tomb is clear,” the Voice says. “Go now, and retrieve what is mine.”"
Scenario_Campaign_041_Objective_1,"All mercenaries must escape through the exit"
Scenario_Campaign_041_Room_2_1,"You break out of the main room into an antechamber. What was once dormant is now teeming with the living corpses of those long ago entombed here. "
Scenario_Campaign_041_Room_2_2,"And more than that, the way back to the surface is now closed off. You look around, desperate for some way to stop this situation from going from bad to worse."
Scenario_Campaign_041_Room_3_1,"You push through the unlocked door, arriving back at the tomb entrance, and your heart sinks at the sight of the narrow ladder leading up to freedom. "
Scenario_Campaign_041_Room_3_2,"You will have to escape this deathtrap one at a time."
Scenario_Campaign_041_Start_1,"You grow furious at the Voice for not warning you about this extra security, and then channel that fury into doing whatever it takes to emerge from this tomb alive."
Scenario_Campaign_041_Success_1,"With the grinding sound of the golems echoing from below, you quickly climb out of the ruin. Only then does the Voice return to you."
Scenario_Campaign_041_Success_2,"“My captors were more clever than I anticipated, I’m afraid. Something blocked my influence from reaching inside the tomb."" "
Scenario_Campaign_041_Success_3,"""Luckily, you were able to navigate the dangers without my assistance. I am happy you found my prison and that you decided to be the avatars of my release. After all this time, I will finally be free."""
Scenario_Campaign_041_Success_4,"With all three vessels in hand, you make your way back to the mountain cave and into the Echo Chamber. "
Scenario_Campaign_042_Objective_1,"Destroy all Vocal Chords "
Scenario_Campaign_042_SCENARIO_MODIFIER_1,"Each Vocal Chord creates a unique detriment to the players until it is destroyed:"
Scenario_Campaign_042_SCENARIO_MODIFIER_2,"6 - All monsters add <nobr>+1 Attack <sprite name=Attack></nobr> to all their attacks."
Scenario_Campaign_042_SCENARIO_MODIFIER_3,"5 - All monsters gain Advantage to all their attacks."
Scenario_Campaign_042_SCENARIO_MODIFIER_4,"4 - All monsters heal 1 hit point at the start of each of their turns."
Scenario_Campaign_042_SCENARIO_MODIFIER_5,"3 - All mercenaries and their summons suffer 1 damage at the start of each of their turns."
Scenario_Campaign_042_SCENARIO_MODIFIER_6,"2 - All mercenaries and their summons gain Disadvantage on all their attacks."
Scenario_Campaign_042_SCENARIO_MODIFIER_7,"1 - All mercenaries and their summons deduct <nobr>-1 Attack <sprite name=Attack></nobr> from all their attacks."
Scenario_Campaign_042_Start_1,"The Voice rings out again, but somehow it is different."
Scenario_Campaign_042_Start_2,"“The power of the Voice is mine! You will be the first I destroy with it!”"
Scenario_Campaign_042_Success_1,"A strong note of dissonance rings out as you snap the last chord, and then there is silence. "
Scenario_Campaign_042_Success_2,"Your vision fades, and you return to the Echo Chamber, now empty and still. "
Scenario_Campaign_042_Success_3,"You search the cavern for signs of the Voice, but all you find is a stone tablet covered in indecipherable foreign glyphs."
Scenario_Campaign_042_VocalChord,"Vocal Chord"
Scenario_Campaign_043_Objective_1,"Kill a number of drakes equal to four times the number of mercenaries "
Scenario_Campaign_043_Success_1,"The waves of red-scaled lizards seem unending, but you have harvested a significant number of corpses and make a calculated retreat. "
Scenario_Campaign_043_Success_2,"At the mouth of the cave, you break into a full sprint and the drakes don't seem too interested in pursuing you. You begin the strenuous task of lugging the hides back to the Crooked Bone. "
Scenario_Campaign_044_Objective_1,"Kill all enemies "
Scenario_Campaign_044_Objective_2,"You lose if any Captive Orchids die"
Scenario_Campaign_044_Start_1,"Redthorn notches an arrow into his bow. “No Orchids will die this day!”"
Scenario_Campaign_044_Success_1,"With the Inox dead, you move around the camp, untying the captive Orchids and helping them to their feet. They offer you their subdued thanks with nods of their heads."
Scenario_Campaign_044_Success_2,"“We are a reserved people,” Redthorn says as he approaches. “Don’t expect them to throw you a party, but know that you have done a monumental good here today."" "
Scenario_Campaign_044_Success_3,"""Most of these residents would have been slaughtered had we not arrived when we did.”"
Scenario_Campaign_044_Success_4,"He falls into silence with a downcast stare. “I still feel it in the pit of my stomach. I thought slaying my captors would make it go away."" "
Scenario_Campaign_044_Success_5,"""I thought saving another village would compensate for failing my own. But it doesn’t. The guilt is still there, and I have been changed by it."""
Scenario_Campaign_044_Success_6,"“This village is not my village, but even if it were, I could not stay. I no longer belong. If you need my help in the future, you can find me among the trees.”"
Scenario_Campaign_045_Objective_1,"Destroy all totems "
Scenario_Campaign_045_Success_1,"You crush the last of the totems and your boots sink back into the muck. You walk over to a severely injured guard, his blood mixing with the sludge around him. "
Scenario_Campaign_045_Success_2,"You grab his collar and pull his face close to your own, interrogating him on the location of the remaining rebels."
Scenario_Campaign_045_Success_3,"“I’ll tell you,” he gasps. “But only because I know that you are not truly evil. Instead of hunting us down, fight with us. Help us take back the city from those demons."" "
Scenario_Campaign_045_Success_4,"""Head east, to the border of the Watcher Mountains. Look to the north of the ash tree grove. Talk with the commander. Help free the city...”"
Scenario_Campaign_045_Success_5,"The light fades from his eyes and you drop him back down into the mud. That was easy enough."
Scenario_Campaign_045_Totem,"Cleansing Totem"
Scenario_Campaign_046_Objective_1,"Kill the Winged Horror "
Scenario_Campaign_046_Room_3_1,"You make your way through the dark fog and find a small clearing at the summit. The screech once again pierces your ears, and a massive demon with a multitude of sharp claws and leathery wings lands before you."
Scenario_Campaign_046_Room_3_2,"""You dare approach my nest?"" You can barely make out the words from its high-pitched wailing. ""I will harvest your corpses and feed them to my children!"""
Scenario_Campaign_046_Success_1,"The giant demon screeches one last time, its timbre and intensity modulating wildly as it spasms in its death throes. Not wanting to get close to its flailing claws, you wait for the creature to expire. "
Scenario_Campaign_046_Success_2,"When it finally does, a stillness washes over the area and day once again breaks in the sky above. "
Scenario_Campaign_046_Success_3,"The view is grand, apart from the blood and carnage that litters the peak. You take it all in and then slowly begin to make your way back down the mountain, satisfied that whatever evil was lurking here will no longer trouble Gloomhaven."
Scenario_Campaign_047_Objective_1,"Kill the Sightless Eye"
Scenario_Campaign_047_Room_2_1,"You reach the final chamber and find the horrible creature—a giant eyestalk with a gaping maw full of teeth instead of an iris."
Scenario_Campaign_047_Room_2_2,"Once again you feel its influence. You begin to see the pointlessness of your actions. You understand that giving into its warm embrace is the only true course of action."
Scenario_Campaign_047_Room_2_3,"But once again you refuse. It grows angry at this, undulating its many tentacles in hostility. The room shakes violently and the corridor from which you entered begins to collapse. "
Scenario_Campaign_047_Room_2_4,"You may have resisted its maddening call, but the fight is far from over."
Scenario_Campaign_047_Success_1,"With the giant eye dead, all of its minions wither and die with it. Thankfully, the room stops shaking as well. "
Scenario_Campaign_047_Success_2,"You can’t get out the way you came in, but you are able to explore the structure further, free of the crushing dread that permeated the air previously."
Scenario_Campaign_047_Success_3,"It is a long journey, but you find your way out of the trench, return to the boat, and head back to Gloomhaven, resolving to never do something like that again."
Scenario_Campaign_048_Objective_1,"Kill the Dark Rider"
Scenario_Campaign_048_Success_1,"The headless spectre screams as you land one final strike against it, and its form begins to dissipate, black wisps of smoke escaping from the cracks in its armour. "
Scenario_Campaign_048_Success_2,"The giant warhose continues to stomp forward through the clearing, but it ages rapidly before your eyes. Grey hairs sprout feverishly out of its mane, and the horse shrinks as its muscles wane. "
Scenario_Campaign_048_Success_3,"Before it even reaches the edge of the clearing, the horse falls over as its brittle bones give way, and with it, an empty set of rusted armour. Within seconds, the horse and its rider are reduced to dust. "
Scenario_Campaign_049_Objective_1,"Kill the Siege Cannon"
Scenario_Campaign_049_Room_2_1,"Fighting through the first wave of soldiers, you arrive at a clearing. The rest of the guards are standing around a very large mechanical cannon.
"
Scenario_Campaign_049_Room_2_2,"“We will use this machine to destroy the walls of Gloomhaven and take back our city,” one of the guards says to you with a hard stare. “It should be able to make short work of you scum as well.”"
Scenario_Campaign_049_Room_2_3,"The cannon whirs and vibrates, glowing red hot at the end of its barrel. “It’s ready! One of the operators yells. “Get out of the way!”"
Scenario_Campaign_049_Success_1,"The cannon lies ruined and broken at your feet, and with it, any hope the rebels had of assaulting Gloomhaven. "
Scenario_Campaign_049_Success_2,"The guards who are still alive scatter, and you return to the demon-ruled Gloomhaven victorious."
Scenario_Campaign_050_Objective_1,"Loot all Ornate Chests with Loot actions (not end-of-turn looting)"
Scenario_Campaign_050_Success_1,"You secure the last of the armory stock just as the rebel fighters break through into the fortress. Cleaning out the demons from the rest of the building becomes short work after that."
Scenario_Campaign_051_Objective_1,"Kill the Gloom"
Scenario_Campaign_051_Start_1,"The Aesther flashes its blades in a mesmerizing dance."
Scenario_Campaign_051_Start_2,"“Come then, brave lambs. Who will be the first to embrace the Gloom?”"
Scenario_Campaign_051_Success_1,"Two swords fall to the stone floor with a sharp ring. The Aesther stands limp, a look of shock on his wounded face.
"
Scenario_Campaign_051_Success_2,"“How dare you,” he mutters. The voice that was once smooth and hypnotic is now gravely and dark. “I have waited thousands of years, and you presume to rob me of the fruits of my labors?”"
Scenario_Campaign_051_Success_3,"The Aesther’s mouth drops slack in death, but still the figure stands, as if held up by invisible strings."
Scenario_Campaign_051_Success_4,"“You can destroy my vessel and banish me from this plane, but it will never be enough. I am eternal. I will return. I will feast on this world once again!”"
Scenario_Campaign_051_Success_5,"At this, the body of the Aesther crumples to the ground and fades out of existence."
Scenario_Campaign_052_Objective_1,"All mercenaries must loot one Ornate Chest before exhausting"
Scenario_Campaign_052_Objective_2,"No mercenary can exhaust before looting an Ornate Chest"
Scenario_Campaign_052_Success_1,"Inside the chests, you find the pieces to a gruesome staff, adorned in maggots, with a decayed skull at its head. "
Scenario_Campaign_052_Success_2,"When you grab the last piece, another set of hidden doors slides open behind the chests. Judging that you have no choice but to take this new route, you enter."
Scenario_Campaign_052_Success_3,"After a while you come upon an intersection of four paths where you rejoin your party and follow the final path back up to the surface."
Scenario_Campaign_053_Objective_1,"Survive for ten rounds "
Scenario_Campaign_053_Objective_2,"Prepare for a door to open"
Scenario_Campaign_053_Success_1,"Finally the ethereal warden finishes his work and lifts the Staff of Xorn high over his head. "
Scenario_Campaign_053_Success_2,"A powerful pulse of green light emanates through the room, reducing all remaining enemies to dust."
Scenario_Campaign_053_Success_3,"The specter moves toward you and offers the staff. “Take it. Bring it to the Palace of Ice in the northern mountains and unseal the tomb of Xorn. You have done well so far. Your journey is almost over.”"
Scenario_Campaign_053_Success_4,"As you grab the staff, the ghost begins to fade from view. “Thank you for allowing me to fulfill my duty, releasing me from my bonds to this realm. Now I can finally rest.”"
Scenario_Campaign_053_Success_5,"With the job complete, you quickly leave the crypt. At least the next location should be a change of scenery after all this rotten flesh and these poison-filled beasts."
Scenario_Campaign_054_Objective_1,"Kill all Harrower Infesters"
Scenario_Campaign_054_Objective_2,"After killing the Harrowers, end the Seeker of Xorn's turn adjacent to the altar"
Scenario_Campaign_054_Room_2_1,"In the main room, a large altar sits near the far wall. Many creatures have gathered here to protect it, however. "
Scenario_Campaign_054_Room_2_2,"Foremost among them is a group of Harrower warriors. The staff pulses even stronger the closer you get to them. "
Scenario_Campaign_054_Room_2_3,"It seems to hunger for their energy—to consume them and take their power for itself."
Scenario_Campaign_054_Success_1,"You place the Staff of Xorn onto the altar, and its power is sucked into the stone in a vortex of green light. The vortex grows, swallowing all of your remaining adversaries."
