Keys,"English [en-GB]"
Scenario_Campaign_079_Objective_3,"Activate all of the pressure plates simultaneously to open the door"
Scenario_Campaign_079_Objective_4,"Kill all Stone Golems to open the door"
Scenario_Campaign_079_Room_4_1,"The door slides away to reveal a plain stone tomb with a large sarcophagus in the center. "
Scenario_Campaign_079_Room_4_2,"Fish runs forward and pushes away the heavy lid. “Finally, my master, you are free from your chains!” "
Scenario_Campaign_079_Room_4_3,"You look on in confusion as the stone coffin crumbles away and a black mist emerges, enveloping the duplicitous thief."
Scenario_Campaign_079_Room_4_4,"“Yessss, and now the Betrayer will consume your flesh and your soul, just as I have done in ages past!” "
Scenario_Campaign_079_Room_4_5,"Fish’s muffled screams die as the mist coalesces around him, forming into the shape of a robed Savvas. "
Scenario_Campaign_079_Room_4_6,"“They were all so easily corrupted, just as you are. The thief ’s soul was a good start, but I want yours, as well!”"
Scenario_Campaign_079_Start_1,"At this, Fish becomes exuberant. “Ah, floor triggers, friend! We each must stand on one, all at once!"" "
Scenario_Campaign_079_Start_2,"""Fish has this one, you go on ahead.” He points off into the darkness and encourages you with a wink."
Scenario_Campaign_079_Success_1,"The evil Savvas screams as you hack away at its stony flesh. Black mist begins to seep out of its wounds and dissipate into the air. "
Scenario_Campaign_079_Success_2,"“My power wanes, but it will grow strong yet again. My corruption is inevitable!” "
Scenario_Campaign_079_Success_3,"The Betrayer crumples into a pile of dust on the floor. "
Scenario_Campaign_079_Success_4,"Eager to be gone from this place, you gather what treasure you can find and make a hasty exit."
Scenario_Campaign_080_Objective_1,"All mercenaries must loot one Ornate Chest"
Scenario_Campaign_080_Objective_2,"All mercenaries must escape "
Scenario_Campaign_080_Room_3_1,"Fully equipped and ready to go, you swing open the dungeon door and are greeted by sunlight and fresh air. "
Scenario_Campaign_080_Room_3_2,"Unfortunately, you are also greeted by sirens and a number of Vigil troops amassing on the bridge in front of you, intent on blocking your escape."
Scenario_Campaign_080_Room_3_3,"“Seems like now is as good a time as any to start some target practice,” an archer on the far side of the bridge yells at you, his crossbow at the ready. “Make your last seconds on this earth count!”"
Scenario_Campaign_080_Success_1,"With a trail of dead and wounded behind you, you dodge the swings of more Vigil guards and quickly climb up onto the stable’s horses. "
Scenario_Campaign_080_Success_2,"You spur them on and trample through the flimsy, wooden door."
Scenario_Campaign_081_Objective_1,"Kill the Colorless"
Scenario_Campaign_081_Room_3_1,"Finally reaching the entrance to the sanctum, you prepare for the last challenge. "
Scenario_Campaign_081_Room_3_2,"You open the door to a place stuck between eternal darkness and blinding light. Two huge demons flank a Savvas whose chest pulses with black and golden lights. "
Scenario_Campaign_081_Room_3_3,"Savvas cannot normally master those elements, but by the look on its face, you guess that doing so drove it mad."
Scenario_Campaign_081_Success_1,"With all your strength, you drive your weapon deep into the Savvas’s chest, shattering its cores. "
Scenario_Campaign_081_Success_2,"Suddenly, the unnatural light and darkness is pulled towards the wound, gathering inside it before bursting out in a huge blast. "
Scenario_Campaign_081_Success_3,"The empty body of the Savvas drops dead to the floor."
Scenario_Campaign_081_Success_4,"The twilight around you returns to normal as you gather your loot and leave the temple. "
Scenario_Campaign_081_Success_5,"One last time, you stare up at the ceiling and marvel at the impossibility of this place."
Scenario_Campaign_082_ExitTile,"Mercenaries that end their turn on this hex can sacrifice a looted artifact to the Beast to complete the scenario."
Scenario_Campaign_082_ItemChoice,""
Scenario_Campaign_082_Objective_1,"Loot the artifacts from the Ornate Chest then escape using either of the exit tiles"
Scenario_Campaign_082_Objective_2,"End the mercenary who looted the artifacts turn on the one-hex corridor and sacrifice one artifact to the Beast"
Scenario_Campaign_082_Objective_3,"Reach the entrance with all mercenaries to escape with all artifacts OR"
Scenario_Campaign_082_Room_5_1,"The Savvas gathered in this back chamber as their last stand. A number of them lie around the area, their bodies mangled and roasted."
Scenario_Campaign_082_Room_5_2," A throne occupies the room’s center, and atop it sits the body of a regal Savvas holding a hammer and a helmet. "
Scenario_Campaign_082_Room_5_3,"Scorched into the wall behind him are the words: “Folly. The Beast awakes. Impossible to control the Mountain’s power. Return them and it shall sleep again.”"
Scenario_Campaign_082_SCENARIO_MODIFIER_1,"The two doors out of the starting room and the two doors to the final room are locked. One will open automatically whenever an elite monster is killed, beginning with the left door in the starting room followed by the right door. The two doors to the final room will then follow the same pattern. "
Scenario_Campaign_082_Success_A_1,"You cast the artifact into the growing pool of liquid flame around you. It sputters and greedily engulfs the item. "
Scenario_Campaign_082_Success_A_2,"The rumbling and shaking, constant up until this point, begins to dissipate. The golems cease their movements, and the demons seem to have vanished. "
Scenario_Campaign_082_Success_A_3,"The cloud of soot still hangs in the sky as you trek back home, but the mountain seems to sleep. For now."
Scenario_Campaign_082_Success_B_1,"You burst through the stone doors, heat and ash licking at your backs. "
Scenario_Campaign_082_Success_B_2,"The shaking of the mountain reaches a crescendo as you careen down the old stone road, now splitting with fissures. "
Scenario_Campaign_082_Success_B_3,"The sky has turned black and massive boulders come rumbling down the slopes. "
Scenario_Campaign_082_Success_B_4,"You barely escape back to Gloomhaven, but the volcano’s devastation is felt even there."
Scenario_Campaign_083_Misc_1,"The last cultist crashes to the floor and you try to catch your breath. "
Scenario_Campaign_083_Misc_2,"Suddenly, the altar starts to tremble, smoke and fire rising from its core. "
Scenario_Campaign_083_Misc_3,"Demons made of flame emerge from it and an inferno engulfs the room. "
Scenario_Campaign_083_Misc_4,"You realize that you have failed to stop the ritual."
Scenario_Campaign_083_Room_3_1,"When you open the stone door, you see an altar in the middle of the room, pulsing with a strange, red energy. "
Scenario_Campaign_083_Room_3_2,"One of the cultists turns to you and lowers her cape, revealing a smile. It is the woman from the Brown Door."
Scenario_Campaign_083_Room_3_3,"“Just in time for the sacrifice,” she says as she turns to the altar. “We needed strong blood to complete our ritual.” The cultists begin chanting as you heft your weapon and charge."
Scenario_Campaign_083_Success_1,"The fire stops, and the only thing that remains on the altar is a small, glowing amber core. "
Scenario_Campaign_083_Success_2,"You pick it up and it feels surprisingly cold in your hand. "
Scenario_Campaign_083_Success_3,"You are able to sell the gem for a nice profit, and you resolve to never help crying women in taverns ever again."
Scenario_Campaign_084_Objective_1,"Kill all enemies "
Scenario_Campaign_084_Objective_2,"Protect the crystal"
Scenario_Campaign_084_SCENARIO_MODIFIER_1,"If, on any monster’s turn, it can move within range to attack the crystal, it will focus on the crystal.

Twice during the scenario, when the crystal suffers damage, any mercenary may burn one card from their hand to have it suffer no damage instead."
Scenario_Campaign_084_SCENARIO_MODIFIER_2,"The left room will reveal at the start of the fourth round, the right room at the start of the sixth round, and the top room at the start of the ninth round. "
Scenario_Campaign_084_Start_1,"“My call has been answered in the nick of time.” An otherworldly voice fills the cavern."
Scenario_Campaign_084_Start_2,"“Please, they have come to destroy me. I beg for your assistance.”"
Scenario_Campaign_084_Success_1,"As the last demon falls, the earth trembles yet again and the light from the crystal fades. Terrifying noises echo throughout the chamber and you brace for more demons to attack.
"
Scenario_Campaign_084_Success_2,"Instead, the voice returns. “I thank you for your intervention. My meditation had gone on for much longer than expected, and the demons were hunting for me, so I sent out a shard to call for help.”"
Scenario_Campaign_084_Success_3,"Light begins to return to the cavern, and you see a glowing Orchid standing in front of you, massive crystals protruding from his head, back, and shoulders. "
Scenario_Campaign_084_Success_4,"“I know now what must happen. Please, keep the shard as a token of my thanks. You should now be able to control its power.”"
Scenario_Campaign_085_Room_5_1,"Entering the inner sanctum, you find a group of Sun Demons gathered around two altars, defending them from the last remnants of the Night Demon army.
"
Scenario_Campaign_085_Room_5_2,"“We thank you for distracting our foes long enough for us take this chamber,” one of the Sun Demons says. "
Scenario_Campaign_085_Room_5_3,"“Now begone! We will take this temple’s power for our own and destroy all those foolish enough to stand in our way!”"
Scenario_Campaign_085_Room_5_4,"You are familiar enough with demons to know that handing a sacred temple over to them is a bad idea. It looks as though you will just have to destroy them all."
Scenario_Campaign_085_SCENARIO_MODIFIER_1,"Your sun-emblazoned medallion glows brightly, causing Light to become Strong and Dark to become Inert at the start of each round."
Scenario_Campaign_085_Success_1,"The last of the Sun Demons falls dim as you land one final blow, sending it to the floor."
Scenario_Campaign_085_Success_2,"“Curse you!” it spits. “With the power of the sun on this plane, we could have been immortal!” "
Scenario_Campaign_085_Success_3,"And now they’re the furthest thing from immortal. Good riddance."
Scenario_Campaign_085_Success_4,"You take one last glance around the chamber, knowing you have little time left before the structure fades away, and you see a beautiful, brilliant orb rise up from one of the altars. "
Scenario_Campaign_085_Success_5,"You reach out to touch it, and the orb just feels right in your hands, as if the temple is rewarding you for keeping it safe."
Scenario_Campaign_085_Success_6,"As you pick up the orb, the walls around you fade. The ceiling becomes translucent and you can see the sun moving behind the mountain peaks in the sky above you. "
Scenario_Campaign_085_Success_7,"Before you can react, you find yourself standing outside next to the small pond, the temple nowhere in sight."
Scenario_Campaign_086_Objective_1,"Allow seven villagers to escape"
Scenario_Campaign_086_Objective_2,"Don't allow five villagers to die"
Scenario_Campaign_086_SCENARIO_MODIFIER_1,"The villagers move towards the green exit tiles with initiative 99 each round. Once reached, they are saved and removed from the map."
Scenario_Campaign_086_Success_1,"You run forward and jump onto the large fishing boat at the end of the docks as it untethers its lines and pushes out into the water. By the time the Vermlings swarm the docks, you are out in the open sea."
Scenario_Campaign_086_Success_2,"“Thank you for holding off those wretched beasts,” one of the sick passengers says. “Without you, most of us on this boat would be dead. Why are you here anyway?”"
Scenario_Campaign_086_Success_3,"You explain how you have been sent by the city guard to investigate the diseased water, and the man snorts. "
Scenario_Campaign_086_Success_4,"“Ha, as if those feckless guards could do anything helpful. We’ve been complaining to them for weeks about the water supply, and they’ve done nothing."" "
Scenario_Campaign_086_Success_5,"""For them to send someone now, it must be affecting people within Gloomhaven’s walls."""
Scenario_Campaign_086_Success_6,"“Whatever the cause, I certainly won’t turn away a well-meaning mercenary. I can lead you to the source of all these problems right now."" "
Scenario_Campaign_086_Success_7,"""We traced the poison to a small cove to the south. The foul creatures inside are pumping out an endless supply of tainted ooze into the ocean.”"
Scenario_Campaign_087_Objective_1,"Kill the Giant Ooze"
Scenario_Campaign_087_Room_2_1,"Battling through the Lurkers, you make your way into the main chamber of the cavern, which is dripping with a thick, putrid slime. "
Scenario_Campaign_087_Room_2_2,"At the center of the room sits a massive lump of sentient ooze, pulsating with malignant bile."
Scenario_Campaign_087_Room_2_3,"Around you, other dark creatures emerge from the muck. The mass in the center seems to be controlling them."
Scenario_Campaign_087_Room_2_4,"If you can find some way to destroy it, you may be able to end the corruption."
Scenario_Campaign_087_Success_1,"Unable to sustain itself any longer, the giant mass quivers and then loses its form, spreading its gelatinous goo all over the already slimy floor. The other creatures around you dissolve into the muck, as well."
Scenario_Campaign_087_Success_2,"You wipe the ooze from your weapons and your body, thankful that whatever cancerous evil was here has now been destroyed. "
Scenario_Campaign_087_Success_3,"Some of this poisonous liquid may still seep into the ocean, and it will take a long time for the effects of what is already there to dissipate, but at least it will not get any worse."
Scenario_Campaign_087_Success_4,"As you return to your boat, you can already see the flow of the ooze waning. You head back to Gloomhaven and report the news."
Scenario_Campaign_088_Objective_1,"Kill the Lurker King"
Scenario_Campaign_088_Objective_2,"Bring the Lurker King's Claw to the crystal"
Scenario_Campaign_088_Room_2_1,"You move into a large, open chamber and begin to feel the effects of a powerful current. "
Scenario_Campaign_088_Room_2_2,"Peering ahead, you can see a large, formidable Lurker struggling with a smaller figure. "
Scenario_Campaign_088_Room_2_3,"At your arrival, the crab-like creature looks in your direction and a chorus of aggressive claw clicking reverberates toward you through the water."
Scenario_Campaign_088_Room_2_4,"The gargantuan Lurker pushes the figure up against the back wall and touches it ceremoniously with the tip of its claw. "
Scenario_Campaign_088_Room_2_5,"In a flash, the figure is encased in a cage of ice and you are finally able to recognize who it is: the Summoner. You were meant to come and save her."
Scenario_Campaign_088_Room_2_6,"Even if you have to tear off that thing’s claw and use it to dispel the ice, well, then that is exactly what you will do."
Scenario_Campaign_088_Success_1,"You touch the dead claw to the prison, and the ice vanishes. "
Scenario_Campaign_089_Success_1,"You look around at the blood-soaked floors of the assassins’ den, coming to grips with the carnage you caused.
"
Scenario_Campaign_089_Success_2,"“A job well done,” the Nightshroud says, silently emerging from the shadows. "
Scenario_Campaign_089_Success_3,"“I wasn’t sure you had it in you, but this is true assassin’s work. Every last one of the syndicate met their end tonight. They thought to hunt us, but we were hunting them.”"
Scenario_Campaign_089_Success_4,"He holds out a bag of gold to you. “It is only right that I share part of my commission with you. I was hired by a rival guild in the Capital to remove the Sin-Ra."" "
Scenario_Campaign_089_Success_5,"""It was never my intention to involve you, but when you mouthed off to that guard...well, I have never been one to pass up an opportunity.”"
Scenario_Campaign_089_Success_6,"You take the pouch in stunned silence. “I hope we don’t meet again,” the Nightshroud says as he walks away. “You never know what side of the contract you may end up on.”"
Scenario_Campaign_090_Misc_1,"The rift between the planes undulates wildly, expelling great gusts of wind that nearly knock you off your feet. "
Scenario_Campaign_090_Misc_2,"Within the wind, you hear the voice of the Spellweaver. “It is almost over. I will now expel the spirits holding the portal open. Destroy them and we will be victorious.”"
Scenario_Campaign_090_Objective_1,"Kill all Demons to close the Rift"
Scenario_Campaign_090_Objective_2,"You lose if no mercenaries are alive and present in the Material Plane"
Scenario_Campaign_090_Objective_3,"Kill all Living Spirits to close the Rift"
Scenario_Campaign_090_Objective_4,"You lose if no mercenaries are alive and present in both planes"
Scenario_Campaign_090_Success_1,"The rift crackles with dark energy and pulses with a chaotic aggression, fighting against its destruction. You take a step towards it and it explodes in a flash of brilliant light.
"
Scenario_Campaign_090_Success_2,"When your vision returns, you find yourself once again standing in a field, with the Spellweaver looking into the distance. "
Scenario_Campaign_090_Success_3,"She reaches out her hand, probing the night air with her fingers. Eventually, she is satisfied that the rift is gone and turns towards you."
Scenario_Campaign_090_Success_4,"“Thank you for your help,” she says. “I know you don’t normally work without payment."" "
Scenario_Campaign_090_Success_5,"""All I can offer you is this censer. It seems most of its power was drained closing the rift, but it should still have enough for your purposes, if not mine.”"
Scenario_Campaign_090_Success_6,"You take it from her outstretched hand and she stares intently at you. “Be careful. There are many powerful and dangerous forces at work in this world.” "
Scenario_Campaign_090_Success_7,"She then silently turns and walks off into the darkness."
Scenario_Campaign_091_Room_2_1,"Up ahead of you, more humans await, but your attention also turns to a disembodied, high-pitched wailing. "
Scenario_Campaign_091_Room_2_2,"""Prepare yourselves, boys,"" one of the loggers yells. ""Here comes another one!"""
Scenario_Campaign_091_Room_2_3,"You think he is talking about you until a ghostly a form materializes in front of you, all chains and volatile anger. "
Scenario_Campaign_091_Room_2_4,"It screams and thrashes around with a blind hatred for eveything near it. It, unfortunately, must be put to rest along with all these bandits. "
Scenario_Campaign_091_Start_1,"""Without the power of the spirits, I am useless,"" the Beast Tyrant says. "
Scenario_Campaign_091_Start_2,"""But I will send in my animal companions to help you. The only way to stop this plague is to kill every single one of those hairless parasites!""  "
Scenario_Campaign_091_Success_1,"The forest falls silent as the last of the loggers are killed and the spirits dissipate. No wailing, no chopping, just silence. "
Scenario_Campaign_091_Success_2,"The Beast Tyrant walks out of the underbrush with a grim look. ""It is unfortunate that the spirits had to be banished from this place, but there was no helping it,"" he says."
Scenario_Campaign_091_Success_3,"""The pain of the forest drove them mad. I hope one day this grove comes back, and with it, the means for my ancestors to find their way home."""
Scenario_Campaign_091_Success_4,"""It may be a long time before I hear their voices again, but I will stay and protect this place as best I can. I thank you for your help. Without you, I fear to think what might have happened."""
Scenario_Campaign_091_Success_5,"A number of animals gather around the Vermling as he turns and shuffles back into the forest. ""Know that you always have my support whenever you need it."""
Scenario_Campaign_092_Objective_1,"Kill all non-city enemies "
Scenario_Campaign_092_Room_2_1,"You round the corner of the alley and narrowly dodge a lance of fire that whizzes by your head. "
Scenario_Campaign_092_Room_2_2,"At the end of the street, a robed Savvas stands with his hands outstretched, channeling another burning projectile."
Scenario_Campaign_092_Room_2_3,"You will certainly admit that you did not expect such low-rent thugs to hire a Savvas to do their dirty work. That couldn’t have come cheap."
Scenario_Campaign_092_Room_2_4,"And if that wasn’t enough, you hear the sounds of whistles behind you. It looks as though the city guards have arrived to break up the party, but these debt collectors have insulted you one too many times for you to just let this go. "
Scenario_Campaign_092_Room_2_5,"This party’s not over until you say it’s over."
Scenario_Campaign_092_Success_1,"With the final thug on the ground and bleeding, you drop your weapons and raise your hands in a nonthreatening pose as more city guards arrive on the scene. "
Scenario_Campaign_092_Success_2,"The captain of the squad eyes you with disappointment."
Scenario_Campaign_092_Success_3,"“And what? I suppose they were the ones who started it and you were just defending yourself?”"
Scenario_Campaign_092_Success_4,"You open your mouth to speak when the owner of the Sleeping Lion chimes in from behind you."
Scenario_Campaign_092_Success_5,"“Aye, I saw the whole thing. Jumped they were by these foreign types. Had no choice but to put them down.”"
Scenario_Campaign_092_Success_6,"The captain’s eyes narrow to slits. “Listen, you undisciplined ruffians. I’m trying to make Gloomhaven a safe, peaceful place. I can’t have you mercenaries running around, spilling blood in the streets!"""
Scenario_Campaign_092_Success_7,"“Luckily, your friend back there is vouching for you, and your victims do indeed look like unsavory criminals, so I’m going to let you off with a warning. But if I ever catch you doing garbage like this again, so help me...”"
Scenario_Campaign_092_Success_8,"The captain trails off in a rage and then storms out of the alley, his squad close behind. The owner of the Sleeping Lion walks up and claps you on the back."
Scenario_Campaign_092_Success_9,"“Hey, I’m just happy you took the fight outside my bar this time.”"
Scenario_Campaign_093_Success_1,"The spirits seem calm and the Lurkers have retreated. You have looted what you can from the ship and are very eager to sail back to Gloomhaven to get your feet onto warm, dry land. "
Scenario_Campaign_093_Success_2,"You take one last look at the strange island and its impaled ship, then do exactly that."
Scenario_Campaign_094_Objective_1,"Kill all enemies "
Scenario_Campaign_094_Objective_2,"Loot the Ornate Chest "
Scenario_Campaign_094_Room_4_1,"With the screams of dying Vermlings at your back, you approach the final nest. Many more of the creatures stand before you, baring their teeth."
Scenario_Campaign_094_Room_4_2,"To the right of the nest, you see an orb of black glass on a crude stone pedestal. A deep crack runs through the glass, nearly splitting the orb in half, and you cannot help but feel you have seen it somewhere before."
Scenario_Campaign_094_Room_4_3,"Equally unnerving is how out of place the orbs look in these dirty surroundings. And why is it here, when all the other treasure is supposedly in the pit?  "
Scenario_Campaign_094_Room_4_4,"You shake the questions from your mind and focus on the task at hand—killing Vermlings."
Scenario_Campaign_094_Success_1,"The Vermlings and their animal allies lie dead at your feet, and you heft the cracked orb in your hand. "
Scenario_Campaign_094_Success_2,"When you first saw it, it almost projected an aura of malevolence, but now, when you look at it up close, it seems much more mundane. "
Scenario_Campaign_094_Success_3,"Not wanting to break it, you hold it against your chest and head over to the pit where all the treasure is supposedly located."
Scenario_Campaign_095_Boulder,"Boulder"
Scenario_Campaign_095_Objective_1,"Kill The Savvas Lavaflow"
Scenario_Campaign_095_Objective_2,"Loot the four keys to unlock the door"
Scenario_Campaign_095_Room_4_1,"The iron bars swing wide and before you stands the antagonistic Savvas, shrouded in flame. The demons above cheer on the spectacle, hungry for more carnage. "
Scenario_Campaign_095_Room_4_2,"“I’m so glad you could join me for the main event,” the Savvas says with a grin. “Prepare to be judged!”"
Scenario_Campaign_095_Start_1,"“And so your judgment begins!” the Savvas yells. “You have slain a demon lord, and it is up to me to prove you unworthy of such an action."" "
Scenario_Campaign_095_Start_2,"""All you need to do is find a way through these gates and best me in combat. You will then be returned to your boring, mundane world."""
Scenario_Campaign_095_Start_3,"""However, if, as I suspect, you are bested by my prison, then I will receive the honor of torturing you for the rest of your short lives!”"
Scenario_Campaign_095_Success_1,"The Savvas howls and drops to its knees. “Perhaps you are worthy,” it sneers."
Scenario_Campaign_095_Success_2,"With one swift swing of your blade, you separate its head from its shoulders and the body drops lifeless to the floor. "
Scenario_Campaign_095_Success_3,"The demons roar with a mixture of indignation and excitement as you hold the head into the air."
Scenario_Campaign_095_Success_4,"You catch a glimpse of an object falling toward you and dodge out of the way as the black glass orb smashes to the ground, shattering into thousands of pieces. "
Scenario_Campaign_095_Success_5,"As it does so, it pulses one more time. "
Scenario_Crypt_BanditArcher_DESCR_0,"You've heard rumours that this is where a group of Bandits train their Archers"
